{
  "schemaVersion": 1,
  "framework": "vue",
  "generatedFrom": [
    "registry.json",
    "specs/components/*.json"
  ],
  "items": [
    {
      "name": "button",
      "title": "Button",
      "category": "component",
      "description": "Typed action control with solid, outline, and glass styles, rounded, pill, and FAB shapes, loading state, sizes, and MDI icons.",
      "status": "beta",
      "version": "0.1.0",
      "registry": "@balsa/button",
      "registryDependencies": [
        "@balsa/balsa-theme"
      ],
      "npmDependencies": [
        "vue",
        "@mdi/font",
        "tailwind-merge"
      ],
      "tokens": [
        "--balsa-color-primary",
        "--balsa-color-primary-foreground",
        "--balsa-color-primary-hover",
        "--balsa-color-primary-active",
        "--balsa-color-focus-ring",
        "radius.control",
        "spacing.control-inline"
      ],
      "documentation": "docs/components/button.md",
      "example": "docs/components/button.md",
      "source": [
        "src/components/ui/Button.vue",
        "src/components/ui/types.ts",
        "src/components/ui/classes.ts"
      ],
      "framework": "vue"
    },
    {
      "name": "button-group",
      "title": "ButtonGroup",
      "category": "component",
      "description": "Connected mutually exclusive actions with semantic color, a Glassmorphism-aware surface-to-glass default, explicit surface, solid, outline, glass, and compact code treatments; rounded or pill outer shapes; four shared sizes; responsive labels; and accessible pressed state.",
      "status": "beta",
      "version": "0.1.0",
      "registry": "@balsa/button-group",
      "registryDependencies": [
        "@balsa/button",
        "@balsa/balsa-theme"
      ],
      "npmDependencies": [
        "vue"
      ],
      "tokens": [
        "--balsa-color-surface",
        "--balsa-color-border-strong",
        "--balsa-color-primary",
        "--balsa-color-primary-foreground",
        "--balsa-color-focus-ring",
        "--balsa-code-control-radius",
        "radius.control"
      ],
      "documentation": "docs/components/button-group.md",
      "example": "docs/components/button-group.md",
      "source": [
        "src/components/ui/ButtonGroup.vue"
      ],
      "framework": "vue"
    },
    {
      "name": "input",
      "title": "Input",
      "category": "component",
      "description": "Accessible labeled native and masked input with outline, surface, soft, and glass materials; compact and default sizes; configurable geometry; phone, monetary, and percentage presets; validation feedback; and loading states.",
      "status": "beta",
      "version": "0.1.0",
      "registry": "@balsa/input",
      "registryDependencies": [
        "@balsa/balsa-theme"
      ],
      "npmDependencies": [
        "vue",
        "@mdi/font",
        "tailwind-merge"
      ],
      "tokens": [
        "--balsa-color-input",
        "--balsa-color-input-foreground",
        "--balsa-color-input-border",
        "--balsa-color-focus-ring",
        "--balsa-color-success",
        "--balsa-color-info",
        "--balsa-color-destructive",
        "--balsa-color-disabled",
        "radius.control"
      ],
      "documentation": "docs/components/input.md",
      "example": "docs/components/input.md",
      "source": [
        "src/components/ui/Input.vue",
        "src/components/ui/form.ts",
        "src/components/ui/classes.ts"
      ],
      "framework": "vue"
    },
    {
      "name": "input-group",
      "title": "Input Group",
      "category": "component",
      "description": "One labelled native text input with typed start/end text or MDI addons, action slots, inline or stacked layout, shared form sizing and geometry, and complete required, disabled, loading, validated, and unvalidated behavior.",
      "status": "beta",
      "version": "0.1.0",
      "registry": "@balsa/input-group",
      "registryDependencies": [
        "@balsa/balsa-theme"
      ],
      "npmDependencies": [
        "vue",
        "@mdi/font",
        "tailwind-merge"
      ],
      "tokens": [
        "--balsa-color-input",
        "--balsa-color-input-foreground",
        "--balsa-color-input-border",
        "--balsa-color-focus-ring",
        "--balsa-color-success",
        "--balsa-color-destructive",
        "radius.control"
      ],
      "documentation": "docs/components/input-group.md",
      "example": "docs/components/input-group.md",
      "source": [
        "src/components/ui/InputGroup.vue",
        "src/components/ui/classes.ts",
        "src/components/ui/form.ts"
      ],
      "framework": "vue"
    },
    {
      "name": "input-otp",
      "title": "Input OTP",
      "category": "component",
      "description": "One accessible fixed-length native verification-code input with semantic-colored visual cells, numeric or alphanumeric filtering, paste and caret editing, optional masking and grouping, surface/outline/soft/solid/glass materials, completion events, and shared form states.",
      "status": "beta",
      "version": "0.1.0",
      "registry": "@balsa/input-otp",
      "registryDependencies": [
        "@balsa/balsa-theme"
      ],
      "npmDependencies": [
        "vue",
        "@mdi/font",
        "tailwind-merge"
      ],
      "tokens": [
        "--balsa-color-input",
        "--balsa-color-input-foreground",
        "--balsa-color-input-border",
        "--balsa-color-focus-ring",
        "--balsa-color-primary",
        "--balsa-color-secondary",
        "--balsa-color-accent",
        "--balsa-color-success",
        "--balsa-color-warning",
        "--balsa-color-info",
        "--balsa-color-destructive",
        "radius.control"
      ],
      "documentation": "docs/components/input-otp.md",
      "example": "docs/components/input-otp.md",
      "source": [
        "src/components/ui/InputOTP.vue",
        "src/components/ui/classes.ts",
        "src/components/ui/form.ts"
      ],
      "framework": "vue"
    },
    {
      "name": "radio-group",
      "title": "Radio Group",
      "category": "component",
      "description": "Accessible native mutually exclusive choices with typed options, a default column layout, semantic selected colors, row and selected-card layouts, shared form validation, sizing, geometry, and loading behavior.",
      "status": "beta",
      "version": "0.1.0",
      "registry": "@balsa/radio-group",
      "registryDependencies": [
        "@balsa/balsa-theme"
      ],
      "npmDependencies": [
        "vue",
        "@mdi/font",
        "tailwind-merge"
      ],
      "tokens": [
        "--balsa-color-input",
        "--balsa-color-input-border",
        "--balsa-color-primary",
        "--balsa-color-secondary",
        "--balsa-color-accent",
        "--balsa-color-success",
        "--balsa-color-warning",
        "--balsa-color-info",
        "--balsa-color-destructive",
        "--balsa-color-focus-ring",
        "radius.control"
      ],
      "documentation": "docs/components/radio-group.md",
      "example": "docs/components/radio-group.md",
      "source": [
        "src/components/ui/RadioGroup.vue",
        "src/components/ui/classes.ts",
        "src/components/ui/form.ts"
      ],
      "framework": "vue"
    },
    {
      "name": "slider",
      "title": "Slider",
      "category": "component",
      "description": "Single-value and independently draggable bounded-range native sliders with horizontal and vertical orientation, formatted output, three sizes, minimum thumb gaps, keyboard, pointer, touch, and form behavior.",
      "status": "beta",
      "version": "0.1.0",
      "registry": "@balsa/slider",
      "registryDependencies": [
        "@balsa/balsa-theme"
      ],
      "npmDependencies": [
        "vue",
        "tailwind-merge"
      ],
      "tokens": [
        "--balsa-color-muted",
        "--balsa-color-primary",
        "--balsa-color-input",
        "--balsa-color-focus-ring",
        "--balsa-color-disabled",
        "radius.control"
      ],
      "documentation": "docs/components/slider.md",
      "example": "docs/components/slider.md",
      "source": [
        "src/components/ui/Slider.vue",
        "src/components/ui/classes.ts",
        "src/components/ui/form.ts"
      ],
      "framework": "vue"
    },
    {
      "name": "popup",
      "title": "Popup",
      "category": "component",
      "description": "Collision-aware interactive rich content anchored to a native button with portal or contained rendering, focus entry/restoration, dismissal, typed materials, sizing, and geometry.",
      "status": "beta",
      "version": "0.1.0",
      "registry": "@balsa/popup",
      "registryDependencies": [
        "@balsa/balsa-theme"
      ],
      "npmDependencies": [
        "vue",
        "tailwind-merge"
      ],
      "tokens": [
        "--balsa-color-surface-elevated",
        "--balsa-color-border-strong",
        "--balsa-color-focus-ring",
        "radius.control",
        "shadow.panel"
      ],
      "documentation": "docs/components/popup.md",
      "example": "docs/components/popup.md",
      "source": [
        "src/components/ui/Popup.vue",
        "src/components/ui/anchored-layer.ts",
        "src/components/ui/classes.ts",
        "src/components/ui/form.ts"
      ],
      "framework": "vue"
    },
    {
      "name": "hover-card",
      "title": "Hover Card",
      "category": "component",
      "description": "Delayed pointer-hover and keyboard-focus previews that preserve focus, bridge pointer movement, collision-flip, escape clipping, and inherit Balsa materials and geometry.",
      "status": "beta",
      "version": "0.1.0",
      "registry": "@balsa/hover-card",
      "registryDependencies": [
        "@balsa/balsa-theme"
      ],
      "npmDependencies": [
        "vue",
        "tailwind-merge"
      ],
      "tokens": [
        "--balsa-color-surface-elevated",
        "--balsa-color-border-strong",
        "--balsa-color-focus-ring",